{"analysis":{"method":"spearman","type":"cross_omics_correlation"},"correlation":{"minimum_pairwise_n":3,"random_seed":20260915,"spearman_permutations":9999},"inputs":{"dataset_a":{"data_type":"metabolomics","missing_tokens":["","NA","N/A","NaN","nan"],"orientation":"samples_rows","path":"a.csv","preprocessing":"quantitative","preprocessing_details":"","sha256":"494f815be20571529cf5363ca4cf112bb570988ae665392e4dbae7f389d33dd5"},"dataset_b":{"data_type":"metabolomics","missing_tokens":["","NA","N/A","NaN","nan"],"orientation":"samples_rows","path":"b.csv","preprocessing":"quantitative","preprocessing_details":"","sha256":"db40d9e2a9053414f6e6fc9689f19bdd70dc245911a4c05da3e833fbce4005b6"}},"multiple_testing":{"family":"all_eligible_cross_dataset_pairs","method":"benjamini_hochberg"},"outputs":{"root":"runs"},"review":{"acknowledged_warning_issue_ids":[],"inspected_run_fingerprint":""},"schema_version":"1.0","study_design":{"notes":"","observation_structure":"independent"}}
